<?xml version="1.0" encoding="UTF-8"?>

<!-- defining entities for include-files -->
<!DOCTYPE MappingRepository SYSTEM "repository.dtd" [
<!ENTITY user SYSTEM "repository_user.xml">
<!ENTITY junit SYSTEM "repository_junit.xml">
<!ENTITY internal SYSTEM "repository_internal.xml">
]>


<MappingRepository>   
<JdbcConnectionDescriptor id="default">
  <dbms.name>MsSQLServer2000</dbms.name>
  <jdbc.level>1.0</jdbc.level>
  <driver.name>com.ddtek.jdbc.sqlserver.SQLServerDriver</driver.name>
  <url.protocol>jdbc</url.protocol>
  <url.subprotocol>datadirect:sqlserver</url.subprotocol>
  <url.dbalias>//localhost:1433;DatabaseName=storefront;SelectMethod=cursor</url.dbalias>
  <user.name>sa</user.name>       
  <user.passwd></user.passwd>
</JdbcConnectionDescriptor>

<!-- include user defined mappings here -->
&user;
   
<!-- include ojb internal mappings here -->
&internal;

</MappingRepository>

